<?xml version="1.0" encoding="UTF-8"?>
<Type_0xc6 messageNo="0" messageSequenceNo="0"
	messageSerialNo="0" xmlns="http://www.example.org/msg_0xc6" xmlns:u="http://www.example.org/UType"
	xmlns:xsi="http://www.w3.org/2001/XMLSchema-instance"
	xsi:schemaLocation="http://www.example.org/msg_0xc6 ../xsd/msg_0xc6.xsd ">
	<Ports>
		<Port>
			<PortNo>0</PortNo>
			<PortInfo>PortInfo</PortInfo>
			<PortUsage>0</PortUsage>
		</Port>
		<Port>
			<PortNo>0</PortNo>
			<PortInfo>PortInfo</PortInfo>
			<PortUsage>0</PortUsage>
		</Port>
	</Ports>
	<CPUs>
		<CPU>
			<CPU_No>0</CPU_No>
			<CPU_Usage>0</CPU_Usage>
		</CPU>
		<CPU>
			<CPU_No>0</CPU_No>
			<CPU_Usage>0</CPU_Usage>
		</CPU>
	</CPUs>
</Type_0xc6>
